{"baseSha":"aaaaaaaaaaaaaaaaaaaaaaaaaaaaaaaaaaaaaaaa","bundlePath":"artifacts/git/run_example01/bbbbbbbbbbbbbbbbbbbbbbbbbbbbbbbbbbbbbbbb.bundle","byteLength":512,"exportGeneration":1,"featureBranch":"squire/aidev-222-run_example01","headSha":"bbbbbbbbbbbbbbbbbbbbbbbbbbbbbbbbbbbbbbbb","kind":"squire-git-bundle-manifest","objectFormat":"sha1","prerequisites":[],"refs":[{"name":"refs/heads/squire/aidev-222-run_example01","oid":"bbbbbbbbbbbbbbbbbbbbbbbbbbbbbbbbbbbbbbbb"}],"runId":"run_example01","schemaVersion":1,"sha256":"ffffffffffffffffffffffffffffffffffffffffffffffffffffffffffffffff","spec":{"path":"artifacts/git/run_example01/workspace-spec.json","schemaId":"urn:squire:git-workspace:v1:workspace-spec","sha256":"cccccccccccccccccccccccccccccccccccccccccccccccccccccccccccccccc"},"verifiedAt":"2026-09-01T00:00:00.000Z","workspaceManifest":{"path":"artifacts/git/run_example01/workspace-manifest.json","schemaId":"urn:squire:git-workspace:v1:workspace-manifest","sha256":"eeeeeeeeeeeeeeeeeeeeeeeeeeeeeeeeeeeeeeeeeeeeeeeeeeeeeeeeeeeeeeee"}}
